username,repo_name,stars,related tags,repo_url
ljianshu,Blog,7900, javascript  css  vue  ajax ,https://github.com/ljianshu/Blog
metafizzy,infinite-scroll,7400, jquery-plugin  ui  ajax  javascript-plugin ,https://github.com/metafizzy/infinite-scroll
olifolkerd,tabulator,6500, react  javascript  jquery  json  data  list  widget  grid  table  ajax  sort  cdnjs  grid-layout  grid-system  tabulator  tabulator-table ,https://github.com/olifolkerd/tabulator
developit,unfetch,5700, polyfill  fetch  xmlhttprequest  ajax  tiny  ponyfill  unfetch ,https://github.com/developit/unfetch
jquery-form,form,5200, javascript  jquery  json  jquery-plugin  ajax  form  html-form  ajax-form  json-form  jquery-form  form-serialization ,https://github.com/jquery-form/form
elbywan,wretch,4700, nodejs  javascript  fetch  http  json  typescript  promise  ajax  http-client  request  formdata  http-request ,https://github.com/elbywan/wretch
Studio-42,elFinder,4600, javascript  php  html5  filemanager  integration  jquery-ui  ajax  elfinder  3rd-party-connectors ,https://github.com/Studio-42/elFinder
dwyl,learn-to-send-email-via-google-script-html-no-server,3100, tutorial  howto  email  example  google-spreadsheet  ajax  form  static-site  html-form  no-server ,https://github.com/dwyl/learn-to-send-email-via-google-script-html-no-server
ded,reqwest,2900, javascript  jquery  ajax  jsonp  reqwest ,https://github.com/ded/reqwest
wendux,ajax-hook,2600, hooks  ajax  ajax-hook  xmlhttprequest-hook ,https://github.com/wendux/ajax-hook
LeaVerou,bliss,2400, promises  events  dom  oop  ajax  es5 ,https://github.com/LeaVerou/bliss
noelboss,featherlight,2100, javascript  jquery  minimal  lightbox  modals  ajax ,https://github.com/noelboss/featherlight
craftpip,jquery-confirm,1900, jquery  jquery-plugin  alert  dialog  modals  ajax  popup  callback  confirm ,https://github.com/craftpip/jquery-confirm
k8w,tsrpc,1800, nodejs  express  node  framework  typescript  protobuf  ajax  grpc  rpc  full-stack  axios  backend-framework  server-framework  nestjs  full-stack-development  full-stack-developer  runtime-type-checking  typescript-rpc-framework  serialization-algorithm  typescript-serialization ,https://github.com/k8w/tsrpc
nette,tracy,1700, debugger  php  profiler  nette  nette-framework  ajax  error-handling  php-errors  tracy  dump-variables  dumper ,https://github.com/nette/tracy
taoensso,sente,1700, transit  clojure  async  clojurescript  websockets  ajax  epl  edn  taoensso  http-kit ,https://github.com/taoensso/sente
loadingio,css-spinner,1700, css  html  loader  ajax  spinner  loading  icon  preloader ,https://github.com/loadingio/css-spinner
joaomilho,Enterprise,1600, redux  docker  language  kubernetes  money  enterprise  data-science  cloud  crypto  progressive-web-app  jvm  quantum  ajax  artificial-intelligence  growth  enterprise-software  enterprise-services  disruptive-technology  enterprise-development ,https://github.com/joaomilho/Enterprise
codingforentrepreneurs,eCommerce,1600, python  bootstrap  jquery  ecommerce  django  stripe  card  ajax  bootstrap4  lookup  mailchimp  jquery-ajax  python3-6  django1-11  custom-queryset  cart-model ,https://github.com/codingforentrepreneurs/eCommerce
MoOx,pjax,1400, navigation  pjax  ajax  pushstate  jquery-pjax  pjax-request ,https://github.com/MoOx/pjax
